<?xml version="1.0" encoding="UTF-8"?>
<mrl:LI_Source xmlns:xlink="http://www.w3.org/1999/xlink"
 xmlns:gco="https://schemas.isotc211.org/19103/-/gco/1.1"
 xmlns:gmw="https://schemas.isotc211.org/19136/-1/gmw/1.1"
 xmlns:gmd="http://www.isotc211.org/2005/gmd"
 xmlns:gml="http://www.opengis.net/gml/3.2"
 xmlns:gsr="http://www.isotc211.org/2005/gsr"
 xmlns:gss="http://www.isotc211.org/2005/gss"
 xmlns:mcc="https://schemas.isotc211.org/19115/-1/mcc/1.3"
 xmlns:mrl="https://schemas.isotc211.org/19115/-1/mrl/1.3"
 xmlns:gts="http://www.isotc211.org/2005/gts"
 xmlns:xsi="http://www.w3.org/2001/XMLSchema-instance"
 xsi:schemaLocation="https://schemas.isotc211.org/19115/-1/mrl/1.3 file:/F:/Code_GitHub_ISO/XML_19115-3/schemas.isotc211.org/19115Restructure/19115/-1/mrl/1.3.0/lineage.xsd">
<mrl:description><gco:CharacterString>Sample source description</gco:CharacterString></mrl:description>
<mrl:sourceSpatialResolution></mrl:sourceSpatialResolution>
<mrl:sourceReferenceSystem></mrl:sourceReferenceSystem>
<mrl:sourceCitation></mrl:sourceCitation>
<mrl:sourceMetadata></mrl:sourceMetadata>
<mrl:scope></mrl:scope>
<mrl:sourceStep></mrl:sourceStep>
</mrl:LI_Source>
